{
  "schema_kind": "odd_world_model.projection_spec",
  "schema_version": "v1",
  "projection_id": "odd_world_model.projection.trade_representation.schema_contract.v1",
  "projection_kind": "schema_contract",
  "source_refs": [
    "odd_world_model.markov_object.trade_representation.trade_contract_state.trade_fpml_001",
    "odd_world_model.world_model_object.trade_representation.commodity_swap_product.product_fpml_001",
    "odd_world_model.world_model_object.trade_representation.master_agreement_reference.trade_fpml_001"
  ],
  "output_summary": "Schema contract projection for the FpML-derived trade domain artifact."
}
