{
  "schema_kind": "odd_world_model.projection_spec",
  "schema_version": "v1",
  "projection_id": "odd_world_model.projection.apra_liquidity.schema_contract.v1",
  "projection_kind": "schema_contract",
  "source_refs": [
    "odd_world_model.markov_object.apra_liquidity.reporting_position.apra_liquidity_position_001",
    "odd_world_model.world_model_object.apra_liquidity.counterparty_bucket.financial_institution",
    "odd_world_model.world_model_object.apra_liquidity.agreement_treatment_basis.master_agreement_reviewed"
  ],
  "output_summary": "Schema contract projection over the bounded APRA-liquidity fragment."
}
